layer,expert_id,Internal_Cohesion,External_Purity,tokens
blocks.2.ff_or_moe,126,0.1828,0.3734,"also, including, whose, now, which, however, subsequently, therefore, eventually, although, previously, both, John, having, later, who, never, usually, thus, sometimes"
blocks.2.ff_or_moe,127,0.2847,0.4197,"., ;, ,, who, and, in, (, during, —, on, with, that, at, before, to, but, from, while, ', :"
blocks.2.ff_or_moe,128,0.2843,0.2964,"all, positive, critics, mixed, public, praise, negative, commercial, international, among, criticism, reception, reviews, worth, favorable, critical, eight, amongst, across, sales"
blocks.2.ff_or_moe,129,0.2465,0.3085,"been, have, become, never, come, actually, always, considered, found, already, not, originally, make, eventually, generally, specifically, also, received, entered, subsequently"
blocks.2.ff_or_moe,130,0.0710,0.3060,"using, the, their, means, John, its, some, an, several, way, virtue, en, his, Michael, itself, both, contrast, law, different, popular"
blocks.2.ff_or_moe,131,0.1649,0.4113,"these, it, they, this, both, what, those, neither, there, nothing, their, some, something, things, whatever, ""[, many, most, the, none"
blocks.2.ff_or_moe,132,0.0856,0.3460,"the, be, their, help, become, its, a, another, have, his, an, this, make, provide, several, do, date, start, The, work"
blocks.2.ff_or_moe,133,0.2177,0.4219,"once, after, before, again, of, the, while, on, as, from, due, until, with, during, to, for, ., at, over, because"
blocks.2.ff_or_moe,134,0.2552,0.3554,""",, ..., You, ""., It, [, !, Love, Some, Me, "";, One, Like, There, Two, Day, America, God, Mr, !"""
blocks.2.ff_or_moe,135,0.1627,0.2960,"would, had, could, response, originally, has, became, crew, now, ’, might, chosen, already, who, design, went, was, movement, population, version"
blocks.2.ff_or_moe,136,0.2099,0.3819,"small, very, large, relatively, few, three, five, six, four, year, seven, significant, considerable, major, prominent, strong, short, separate, larger, full"
blocks.2.ff_or_moe,137,0.0814,0.3459,"support, from, problems, of, rights, on, development, in, levels, status, services, within, issues, interest, numbers, ., for, figures, information, data"
blocks.2.ff_or_moe,138,0.1193,0.3680,"use, a, the, uses, of, an, in, up, using, only, at, their, two, on, such, several, various, both, as, these"
blocks.2.ff_or_moe,139,0.1552,0.2764,"ford, ley, win, ge, Or, wood, ch, well, bad, tie, mill, man, Sy, Dun, de, am, Char, cor, Br, mar"
blocks.2.ff_or_moe,140,0.2089,0.3562,"De, Con, Ex, Mo, Im, Bo, Dis, Gu, Str, br, Un, Re, Co, Col, Be, Al, Ac, Le, Ch, En"
blocks.2.ff_or_moe,141,0.0710,0.2853,"°, F, south, degrees, north, long, W, C, left, [PAD], moving, en, S, return, B, best, Do, short, I, lower"
blocks.2.ff_or_moe,142,0.2509,0.3714,"were, would, have, had, they, are, did, may, could, might, initially, eventually, went, previously, should, didn, chose, can, often, gave"
blocks.2.ff_or_moe,143,0.3030,0.3004,"enough, reasons, political, ways, possible, clear, news, ly, ized, times, evidence, recommended, progress, choice, historical, reason, food, sources, individuals, apparent"
blocks.2.ff_or_moe,144,0.2554,0.3286,"%, 60, 25, 23, mm, 75, percent, °, 10, 40, 24, 6, 45, [PAD], 35, 50, 8, (, 5, 12"
blocks.2.ff_or_moe,145,0.5721,0.3131,"), ),, )., ""), );, ], )"", .), ""),, "")., ):, km, ],, USD, )"",, ]"", '), .),, ]""., spelling"
blocks.2.ff_or_moe,146,0.1998,0.2800,"States, Kingdom, United, various, Royal, different, subsequent, few, American, 1st, Can, same, Arab, West, original, Nations, York, Five, First, Or"
blocks.2.ff_or_moe,147,0.1950,0.3010,"s, own, final, original, primary, lack, immediate, first, supposed, main, second, initial, minimal, right, overly, increasing, third, health, unique, ultimately"
blocks.2.ff_or_moe,148,0.0954,0.3649,"his, the, their, a, him, another, nearly, five, them, scored, an, scoring, four, playing, two, six, won, second, representing, her"
blocks.2.ff_or_moe,149,0.2510,0.4060,"—, (, and, ', ,, was, ;, had, ., –, would, were, on, from, has, for, ’, became, in, to"
blocks.2.ff_or_moe,150,0.2717,0.4453,"by, with, on, from, into, in, ., to, through, against, at, for, under, ;, ,, among, after, between, and, as"
blocks.2.ff_or_moe,151,0.3386,0.2984,"lack, previous, absence, success, 2004, various, differing, move, losses, original, actual, supposed, varying, approaching, extremely, needs, specific, failure, perceived, poor"
blocks.2.ff_or_moe,152,0.1411,0.3847,"they, not, no, been, neither, none, some, the, their, several, any, both, those, various, little, another, given, it, she, nothing"
blocks.2.ff_or_moe,153,0.2876,0.3930,"American, English, German, Chinese, Indian, British, French, Russian, Americans, Spanish, Greek, Western, Japanese, troops, Italian, Great, Eastern, Red, Soviet, government"
blocks.2.ff_or_moe,154,0.1009,0.3814,"other, the, then, its, others, three, /, later, two, E, T, several, a, various, out, five, final, his, an, those"
blocks.2.ff_or_moe,155,0.0941,0.3828,"including, those, include, the, included, a, one, The, being, an, such, several, these, two, either, its, some, "", three, particularly"
blocks.2.ff_or_moe,156,0.1477,0.3774,"the, a, an, On, on, his, July, September, October, June, August, April, what, The, their, November, her, February, offense, behalf"
blocks.2.ff_or_moe,157,0.2870,0.3777,"was, would, did, could, came, became, may, cannot, eventually, ultimately, never, has, does, failed, had, will, might, can, should, went"
blocks.2.ff_or_moe,158,0.2367,0.2961,"were, members, players, have, including, writers, characters, actors, officers, residents, artists, are, musicians, historians, ities, still, ents, accounts, students, of"
blocks.2.ff_or_moe,159,0.2794,0.3228,"French, old, third, Canadian, happening, Dutch, fourth, fifth, British, seventh, ient, Fourth, northern, secondary, Second, term, maximum, title, proposed, period"
blocks.2.ff_or_moe,160,0.1672,0.3574,";, ., —, were, (, ."", ),, have, )., which, are, :, between, ""., would, ,, that, also, who, )"
blocks.2.ff_or_moe,161,0.0887,0.3246,"of, name, use, itself, position, to, idea, was, method, they, for, being, nature, role, change, situation, changes, value, hypothesis, question"
blocks.2.ff_or_moe,162,0.3190,0.2910,"related, producing, style, assisted, aided, based, specific, like, designated, carry, built, proposes, meaning, human, text, driven, powered, produce, therefore, 71"
blocks.2.ff_or_moe,163,0.3742,0.3109,"Another, Three, Small, Greenwich, 2003, One, 2004, Martin, Dun, 2008, vast, Series, Many, By, Dead, "")., His, Phil, Each, Nation"
blocks.2.ff_or_moe,164,0.2818,0.3510,"Music, Master, Entertainment, magazine, 2, City, Europe, Live, One, Japan, Life, Island, Power, Game, Rock, Film, Magazine, Star, World, TV"
blocks.2.ff_or_moe,165,0.3191,0.3464,"Each, Act, These, They, This, There, The, After, °., excellent, agraph, neither, She, It, With, interchanges, [...], either, Eventually, [PAD]"
blocks.2.ff_or_moe,166,0.1220,0.3629,"', ’, members, team, group, title, kingdom, nation, club, of, itself, leadership, fleet, army, world, leader, name, following, organization, first"
blocks.2.ff_or_moe,167,0.1439,0.4283,"but, which, and, who, while, although, or, also, whose, so, though, including, then, with, having, along, "", as, that, for"
blocks.2.ff_or_moe,168,0.2475,0.3025,"att, comm, aff, p, rep, fe, inf, sp, squ, fl, sn, sk, Sl, ch, down, wh, outs, imp, sw, j"
blocks.2.ff_or_moe,169,0.1058,0.3441,"power, services, support, control, operations, relief, forces, from, service, supply, of, and, protection, staff, ,, ships, group, scenes, rights, force"
blocks.2.ff_or_moe,170,0.1203,0.3253,"up, down, out, into, through, him, across, ged, back, king, them, off, ling, ping, ting, with, open, old, his, away"
blocks.2.ff_or_moe,171,0.2341,0.3471,"later, north, further, next, south, formal, east, soon, named, returned, progress, released, planned, afterwards, recorded, subsequently, earlier, eventually, renamed, Later"
blocks.2.ff_or_moe,172,0.4642,0.3577,"guns, torpedo, units, artillery, attached, gun, armor, aircraft, amidships, arms, rifle, armed, steam, armoured, mounted, machine, weapon, firing, Ot, Vickers"
blocks.2.ff_or_moe,173,0.1560,0.3305,"the, these, their, any, those, approximately, interest, enemy, activity, his, total, increasing, hostile, each, ore, 120, sustained, several, Of, seeing"
blocks.2.ff_or_moe,174,0.2351,0.2930,"large, small, nearby, private, third, potential, group, smaller, full, significant, independent, separate, possible, general, increase, shipping, newspaper, rising, major, remnant"
blocks.2.ff_or_moe,175,0.1221,0.3337,"body, ship, power, of, woman, ball, book, company, design, school, who, image, fish, boy, shot, -, board, model, raised, man"
blocks.2.ff_or_moe,176,0.1771,0.4277,"the, their, these, this, another, them, his, those, both, some, him, a, what, such, each, either, her, its, an, various"
blocks.2.ff_or_moe,177,0.1951,0.2663,"these, May, this, San, Or, various, Per, Had, nearby, particular, Her, Cor, Con, June, March, To, 2004, December, Sam, France"
blocks.2.ff_or_moe,178,0.1075,0.3558,"take, up, took, down, takes, their, taking, some, lost, his, out, edge, those, hold, breaks, leads, the, leading, control, part"
blocks.2.ff_or_moe,179,0.1231,0.2961,"well, enough, -, long, low, close, proportion, short, good, established, defined, straight, time, compared, inter, non, prepared, high, far, food"
blocks.2.ff_or_moe,180,0.1912,0.4308,"., -, ;, ,, (, and, —, –, :, ."", of, /, or, is, 2, are, 1, ..., would, has"
blocks.2.ff_or_moe,181,0.1982,0.2880,"same, various, entire, previous, 2003, staff, First, United, 2007, project, whole, Council, V, 2002, 2004, larger, national, production, College, group"
blocks.2.ff_or_moe,182,0.1140,0.4095,"., ;, ""., (, —, ."", ,, )., He, while, and, One, will, instead, [PAD], She, may, with, After, That"
blocks.2.ff_or_moe,183,0.0881,0.3216,"of, run, attempt, time, with, period, for, from, strategy, based, set, battle, involving, within, ceremony, partnership, event, consisting, on, meeting"
blocks.2.ff_or_moe,184,0.1010,0.2872,"', himself, ie, Davis, never, did, Lo, is, who, Lee, not, son, at, es, Anderson, ’, id, film, ley, Key"
blocks.2.ff_or_moe,185,0.1336,0.4064,"a, several, an, some, significant, additional, the, its, numerous, many, him, them, large, two, most, more, their, it, his, greater"
blocks.2.ff_or_moe,186,0.0728,0.3837,"called, "", named, calling, it, the, calls, a, him, among, The, call, his, one, its, names, considered, to, an, them"
blocks.2.ff_or_moe,187,0.1361,0.3437,"., ;, —, (, ,, of, and, during, which, that, population, with, model, from, ."", response, have, also, or, who"
blocks.2.ff_or_moe,188,0.2108,0.3880,"The, This, 000, He, In, A, although, It, When, Although, which, She, While, meaning, There, But, Mark, They, After, [PAD]"
blocks.2.ff_or_moe,189,0.1544,0.3430,"W, Qu, Le, H, P, M, To, Me, Br, Co, Or, Bo, L, Mac, De, Little, Lo, G, K, J"
blocks.2.ff_or_moe,190,0.0833,0.3562,"the, The, T, this, his, these, W, In, any, At, G, King, George, various, Of, John, St, which, choice, C"
blocks.2.ff_or_moe,191,0.4411,0.3279,"Also, )."", Its, This, Players, Although, )"",, ""[, They, therefore, )""., "")., diale, Thus, Both, oves, Brook, These, She, With"
blocks.2.ff_or_moe,192,0.1770,0.3130,"this, same, period, kind, case, particular, situation, time, initial, move, new, live, decision, distinction, project, final, happening, story, episode, type"
blocks.2.ff_or_moe,193,0.1889,0.4056,"but, although, while, though, despite, including, which, and, however, with, after, when, making, along, as, because, so, where, due, before"
blocks.2.ff_or_moe,194,0.1326,0.4162,"and, which, or, but, including, with, while, as, who, for, also, although, though, along, "", [, both, whose, such, like"
blocks.2.ff_or_moe,195,0.2764,0.3047,"cause, Another, She, Gr, Other, injured, smaller, ca, sm, rose, Those, choose, Five, Or, roll, Stark, John, Ross, asks, Ros"
blocks.2.ff_or_moe,196,0.1252,0.3149,"been, have, had, has, also, ite, found, suffered, ,, no, come, can, died, not, ford, won, ia, ever, ati, id"
blocks.2.ff_or_moe,197,0.2583,0.3194,"á, gar, č, z, ro, ó, é, fu, š, r, ber, os, bet, k, gi, y, s, ks, ven, bu"
blocks.2.ff_or_moe,198,0.3644,0.2962,"2003, Other, injured, immediate, Their, Right, chosen, Work, preferred, Park, Its, Dead, greatest, 59, original, extended, entire, Hall, pleasant, Edgar"
blocks.2.ff_or_moe,199,0.1363,0.3956,"this, several, the, many, about, various, these, use, its, their, both, three, a, having, making, his, such, other, some, which"
blocks.2.ff_or_moe,200,0.4354,0.2771,"wood, Stone, River, horn, gang, Lake, Welsh, Leigh, Brand, Tiger, tan, Valley, Cheshire, Barry, Norman, Hill, ville, Jazz, Road, Development"
blocks.2.ff_or_moe,201,0.1730,0.4635,"season, year, day, week, years, episode, before, after, seasons, when, period, months, month, October, September, of, June, July, ,, days"
blocks.2.ff_or_moe,202,0.1542,0.4193,"the, both, several, this, these, their, various, many, his, between, those, such, two, some, different, early, most, other, each, multiple"
blocks.2.ff_or_moe,203,0.2565,0.2880,"significant, amount, reason, male, visual, female, example, major, minor, total, exception, British, primary, possible, thing, source, increase, hundred, note, character"
blocks.2.ff_or_moe,204,0.3943,0.3274,"Kh, Tak, ah, ana, ik, ai, aka, Shah, aki, Mah, uk, j, Sar, ā, aj, ak, Nag, ata, Raj, mad"
blocks.2.ff_or_moe,205,0.1081,0.3413,"later, other, was, subsequently, then, had, subsequent, E, others, County, also, has, is, S, W, would, eventually, /, did, its"
blocks.2.ff_or_moe,206,0.3683,0.2572,"shaped, specific, based, related, type, handed, western, minute, style, induced, producing, day, bearing, weekly, hel, offs, tracked, yi, ‑, eyed"
blocks.2.ff_or_moe,207,0.1752,0.4119,"back, into, out, away, going, to, go, returning, went, down, came, returned, coming, sent, come, through, brought, comes, moves, moved"
blocks.2.ff_or_moe,208,0.2272,0.3907,"On, In, He, She, [PAD], It, To, As, This, With, By, For, Act, Although, Smith, Bl, They, These, The, Bo"
blocks.2.ff_or_moe,209,0.2455,0.3340,"oc, og, oph, od, ol, ot, ph, system, ion, c, om, op, ar, id, col, ne, rig, pet, ide, ag"
blocks.2.ff_or_moe,210,0.7037,0.2605,"Del, conventional, Bo, strict, PC, CA, FS, 读, 隆, overeign, 汪, overnor, ٰ, Ụ, 충, 樉, McC, 展, 銘, Ｘ"
blocks.2.ff_or_moe,211,0.2810,0.3178,"own, original, initial, Its, various, traditional, large, current, small, entire, existing, final, immediate, primary, vast, internal, normal, legal, distinctive, basic"
blocks.2.ff_or_moe,212,0.4635,0.3323,"however, Meanwhile, instance, meanwhile, However, example, Finally, analysis, among, exceptions, result, Elsewhere, Similar, Overall, additionally, Rowe, examples, Again, consisted, consists"
blocks.2.ff_or_moe,213,0.2352,0.3292,"be, do, help, make, have, keep, come, become, match, change, release, play, give, go, create, move, transfer, remain, return, how"
blocks.2.ff_or_moe,214,0.1272,0.3333,"report, ,, review, was, had, campaign, interview, announcement, reports, were, revealed, of, :, ceremony, failure, ""[, published, investigation, ;, 2010"
blocks.2.ff_or_moe,215,0.3426,0.4085,"To, This, On, The, At, After, While, By, Because, For, They, Since, Some, However, Despite, With, As, Although, Their, From"
blocks.2.ff_or_moe,216,0.3260,0.3640,"political, public, religious, military, civil, media, medical, economic, legal, human, historical, nature, personal, scientific, rights, actions, social, private, authority, Civil"
blocks.2.ff_or_moe,217,0.2818,0.3336,"ation, ations, ist, es, ic, s, ing, ant, bol, ors, ants, er, ists, Ab, Cond, ical, ate, ator, ions, ion"
blocks.2.ff_or_moe,218,0.3290,0.3419,"separate, powerful, large, smaller, small, larger, corps, huge, Donald, waiting, return, response, unique, 180, 2003, “, 170, 2004, proposed, report"
blocks.2.ff_or_moe,219,0.2433,0.4077,";, ., before, and, with, (, ,, while, which, —, in, who, between, that, on, but, at, without, for, were"
blocks.2.ff_or_moe,220,0.3611,0.4059,"This, They, [PAD], There, These, She, The, After, It, While, With, Its, When, Although, His, Their, Both, That, At, Each"
blocks.2.ff_or_moe,221,0.2125,0.3640,"used, said, chosen, sent, considered, made, presented, responsible, able, produced, created, found, also, held, taken, already, given, present, brought, built"
blocks.2.ff_or_moe,222,0.1401,0.3475,",, ', (, ., was, ;, —, had, ’, and, ("", who, has, is, would, Mor, from, also, Bay, ka"
blocks.2.ff_or_moe,223,0.1707,0.3063,"able, ment, ing, their, ation, ors, ive, ers, the, age, ability, ably, control, ments, ant, what, some, ants, this, them"
blocks.2.ff_or_moe,224,0.3541,0.3671,"At, With, Because, Both, They, ""[, On, She, However, Thus, Lord, This, According, After, While, cannot, Finally, Meanwhile, Eventually, He"
blocks.2.ff_or_moe,225,0.2043,0.3649,"music, culture, production, theory, -, school, science, education, fiction, literature, law, technology, ,, works, play, architecture, history, art, tradition, politics"
blocks.2.ff_or_moe,226,0.1142,0.3788,"other, also, the, their, several, many, had, various, its, some, have, more, never, a, those, eventually, later, others, an, now"
blocks.2.ff_or_moe,227,0.2107,0.3770,"were, from, ,, are, ;, became, used, and, ., was, of, on, (, in, which, at, have, around, —, may"
blocks.2.ff_or_moe,228,0.2596,0.3587,"album, title, song, year, music, singles, release, voice, group, single, book, opening, studio, debut, songs, theme, couple, television, scene, soundtrack"
blocks.2.ff_or_moe,229,0.2339,0.3653,"these, they, this, there, This, having, Despite, neither, If, Finally, such, before, Once, despite, After, ""[, Eventually, successful, Thus, Since"
blocks.2.ff_or_moe,230,0.1667,0.2829,"per, Per, pers, character, square, pre, Hol, ping, each, specific, reach, cent, new, direct, Summer, different, normal, med, common, con"
blocks.2.ff_or_moe,231,0.2555,0.3133,"group, city, inner, rear, center, lower, area, whole, entire, resulting, environment, remaining, base, third, remainder, surrounding, underground, large, nearby, core"
blocks.2.ff_or_moe,232,0.1483,0.3522,"both, those, two, Those, Both, three, previous, previously, early, other, earlier, live, remaining, particular, highly, latter, existing, outside, these, original"
blocks.2.ff_or_moe,233,0.1512,0.4041,"while, although, when, then, he, thus, they, so, others, eventually, after, therefore, there, also, later, not, despite, instead, even, she"
blocks.2.ff_or_moe,234,0.1863,0.4136,"while, and, [PAD], whilst, but, ), which, along, ”, ,"", "",, )"", whereas, although, He, plus, ),, single, ""), whose"
blocks.2.ff_or_moe,235,0.2919,0.4424,"., ;, (, ,, with, in, and, :, of, from, at, on, —, that, while, before, for, or, by, without"
blocks.2.ff_or_moe,236,0.1652,0.3951,"., ;, ,, —, that, which, :, have, (, who, and, such, previously, ..., ."", at, of, or, in, about"
blocks.2.ff_or_moe,237,0.1541,0.4217,"these, the, both, many, several, their, various, this, some, those, his, other, each, a, such, an, most, John, different, what"
blocks.2.ff_or_moe,238,0.1229,0.3732,"them, their, these, him, it, his, both, its, around, the, themselves, various, several, izes, ating, numerous, some, ates, on, a"
blocks.2.ff_or_moe,239,0.2513,0.3419,"her, Her, personal, original, my, hers, entire, last, normal, everyday, own, extraordinary, father, alternate, private, children, mother, auxiliary, career, My"
blocks.2.ff_or_moe,240,0.2762,0.4586,"victory, season, team, game, –, campaign, winning, defeat, league, football, score, goal, win, title, against, 2007, League, goals, victories, games"
blocks.2.ff_or_moe,241,0.2262,0.4098,"by, in, with, at, to, a, for, on, as, from, during, when, the, only, written, after, into, both, an, there"
blocks.2.ff_or_moe,242,0.3439,0.3740,"The, This, There, [PAD], On, They, These, Both, When, At, Although, What, ""..., It, According, She, With, Thus, Because, During"
blocks.2.ff_or_moe,243,0.1892,0.3414,"City, Central, High, County, National, ’, Town, Bay, Government, Can, In, West, Ben, Bar, Red, El, State, Film, East, North"
blocks.2.ff_or_moe,244,0.2612,0.3439,"powerful, different, large, small, separate, significant, prominent, additional, new, regular, private, independent, broad, distinct, strong, repeated, various, highly, specific, good"
blocks.2.ff_or_moe,245,0.3782,0.2685,"sources, historical, secondary, noble, male, university, background, average, relationship, classical, alternate, ones, approach, individuals, adult, Massachusetts, intellectual, college, divisions, middle"
blocks.2.ff_or_moe,246,0.2778,0.0000,"G, H, J, P, R, K, O, U, W, V, D, Z, B, E, C, F, M, N, L, Y"
blocks.2.ff_or_moe,247,0.2742,0.3427,"would, might, could, they, should, eventually, went, will, may, came, became, probably, cannot, never, must, these, did, have, appeared, ultimately"
blocks.2.ff_or_moe,248,0.4068,0.4025,"eastern, United, nearby, adjacent, east, north, southern, northern, Battle, south, southeast, allied, Lines, west, northeast, morning, southwest, Central, remainder, islands"
blocks.2.ff_or_moe,249,0.2423,0.3181,"was, It, would, has, could, had, became, came, does, did, entered, gave, critic, eventually, can, iner, gem, went, drew, quickly"
blocks.2.ff_or_moe,250,0.1105,0.3496,"himself, herself, themselves, itself, directly, as, :, became, came, responsible, into, appear, with, again, in, instead, being, had, on, simply"
blocks.2.ff_or_moe,251,0.4397,0.2483,"iny, ο, fake, mounted, ), yard, );, Virginia, Poe, ""), .), bit, 300, imen, mos, FE, mm, ious, drawn, irl"
blocks.2.ff_or_moe,252,0.3253,0.4166,"They, On, The, This, One, Other, Another, According, Some, She, It, [PAD], ""[, There, Although, With, Their, [...], While, From"
blocks.2.ff_or_moe,253,0.4294,0.3025,"exact, vast, remaining, cannot, percentage, reasons, closest, remainder, smaller, lack, precise, Many, biggest, greater, residents, largest, entire, shorter, increasing, empty"
blocks.2.ff_or_moe,254,0.3779,0.3092,"After, Their, Once, While, Brian, When, They, Before, Upon, phylogenetic, Act, Mr, whilst, David, Had, Five, Finally, Stream, Other, On"
blocks.2.ff_or_moe,255,0.3336,0.3343,"On, apparently, Both, therefore, This, Other, accidentally, That, With, These, She, reportedly, Then, Also, never, Those, nevertheless, also, His, Research"
blocks.3.ff_or_moe,0,0.4776,0.6441,"October, November, December, September, June, July, January, August, February, April, May, March, 19, 29, 23, 27, 17, 22, 26, 25"
blocks.3.ff_or_moe,1,0.1257,0.3091,"the, St, Cor, Har, San, W, Le, De, New, War, his, G, Un, Ar, Ke, Al, Ch, H, Car, P"
blocks.3.ff_or_moe,2,0.2773,0.3004,"years, 19th, last, 20th, entire, recent, subsequent, months, various, 1970s, previous, period, next, traditional, summer, whole, future, immediate, middle, 1960s"
blocks.3.ff_or_moe,3,0.1188,0.3459,"significant, major, time, more, other, good, one, single, further, reason, serious, longer, previous, real, great, new, specific, way, change, large"
blocks.3.ff_or_moe,4,0.1296,0.3953,"yet, such, that, thus, here, eventually, behind, likely, previously, actually, only, better, so, initially, already, nearly, further, rapidly, over, too"
blocks.3.ff_or_moe,5,0.1604,0.4124,"of, that, from, for, to, on, which, in, with, between, by, behind, created, since, book, ;, about, "", ., —"
blocks.3.ff_or_moe,6,0.3491,0.3232,"be, create, make, become, take, keep, bring, produce, move, establish, serve, provide, find, build, help, change, perform, shift, release, replace"
blocks.3.ff_or_moe,7,0.1322,0.3590,"s, Gr, No, Or, They, H, Their, When, Other, An, Don, d, extended, On, 80s, own, na, He, B, It"
blocks.3.ff_or_moe,8,0.2627,0.3536,"created, used, done, chosen, real, prepared, designed, written, seen, put, tested, true, affected, approved, made, purpose, given, intended, shown, sent"
blocks.3.ff_or_moe,9,0.1933,0.3676,"B, The, C, J, Sh, T, N, D, H, G, A, S, related, the, his, Red, M, W, St, R"
blocks.3.ff_or_moe,10,0.2587,0.3242,"years, small, days, weeks, hours, different, times, months, additional, minutes, separate, short, people, consecutive, large, smaller, independent, million, members, songs"
blocks.3.ff_or_moe,11,0.1830,0.3530,"large, smaller, small, larger, north, higher, northern, south, various, local, other, low, high, city, lower, great, very, important, more, surrounding"
blocks.3.ff_or_moe,12,0.1075,0.4064,"then, later, most, sometimes, including, which, other, also, now, they, many, more, these, although, thus, various, some, those, the, usually"
blocks.3.ff_or_moe,13,0.2209,0.4015,";, ., because, when, during, while, but, without, :, due, before, throughout, until, since, within, by, ),, prior, after, despite"
blocks.3.ff_or_moe,14,0.2580,0.3166,"be, take, have, become, make, create, not, come, develop, serve, produce, see, find, change, keep, cause, move, possibly, help, do"
blocks.3.ff_or_moe,15,0.1593,0.3301,"these, their, more, further, scenes, buildings, proposals, large, plans, those, problems, additional, developments, this, leave, reasons, work, several, dies, ""."
blocks.3.ff_or_moe,16,0.2247,0.4507,",, ', and, ., ;, (, —, ’, –, in, /, to, after, during, for, was, as, before, &, )"
blocks.3.ff_or_moe,17,0.3780,0.3638,"officials, services, areas, management, systems, literature, service, groups, operations, schools, business, studies, education, sales, forces, games, units, troops, architecture, leaders"
blocks.3.ff_or_moe,18,0.3151,0.4017,"The, In, This, After, They, At, By, From, When, However, These, There, During, According, It, She, To, For, On, As"
