layer,expert_id,Internal_Cohesion,External_Purity,tokens
blocks.1.ff_or_moe,230,0.0854,0.3142,"game, full, 5, middle, first, United, short, team, next, more, original, chief, second, mid, performance, larger, Mac, other, following, William"
blocks.1.ff_or_moe,231,0.1896,0.3757,"been, have, very, never, become, already, often, also, no, originally, eventually, had, always, highly, sometimes, previously, many, subsequently, now, found"
blocks.1.ff_or_moe,232,0.3595,0.3737,"first, last, final, next, third, second, fourth, earliest, largest, fifth, seventh, worst, sixth, oldest, initial, latest, latter, ninth, nearest, highest"
blocks.1.ff_or_moe,233,0.1895,0.4262,"another, this, one, these, two, new, four, five, six, three, seven, eight, last, additional, nine, Another, pair, same, different, third"
blocks.1.ff_or_moe,234,0.1115,0.3730,"first, time, various, most, the, many, other, two, new, three, previous, more, top, same, large, remaining, s, four, these, very"
blocks.1.ff_or_moe,235,0.3377,0.4278,"not, never, still, always, often, sometimes, likely, probably, already, possibly, frequently, have, usually, occasionally, also, generally, rarely, actually, mostly, ever"
blocks.1.ff_or_moe,236,0.2318,0.4281,"A, An, Two, Another, One, Un, Some, Most, Three, His, All, Several, In, The, On, Their, E, Many, As, Every"
blocks.1.ff_or_moe,237,0.1257,0.3438,"s, first, final, health, original, last, very, 2001, immediate, right, great, 2005, third, various, ultimately, most, four, total, main, commercial"
blocks.1.ff_or_moe,238,0.1295,0.4143,"the, from, their, its, his, several, a, these, two, this, being, both, The, various, those, an, each, most, three, From"
blocks.1.ff_or_moe,239,0.1287,0.3648,"around, about, approximately, surrounding, near, 10, between, outside, next, Around, this, following, various, some, large, five, almost, nearly, most, six"
blocks.1.ff_or_moe,240,0.0857,0.3352,"most, very, To, top, first, same, The, last, many, large, following, rest, work, Canadian, previous, entire, United, only, other, early"
blocks.1.ff_or_moe,241,0.2769,0.2789,"featured, involved, implied, feature, included, second, DC, various, cost, first, displayed, fifth, fourth, prominently, Critics, presenting, story, supporting, quick, competing"
blocks.1.ff_or_moe,242,0.1258,0.4159,"the, which, The, now, his, most, this, I, first, its, two, more, [, s, a, (, their, all, he, A"
blocks.1.ff_or_moe,243,0.2295,0.3081,"team, 2004, 2005, 2007, England, league, Central, top, 2008, entire, previous, middle, apparent, international, second, central, 2009, opposition, first, pool"
blocks.1.ff_or_moe,244,0.3092,0.4144,"It, This, The, They, Its, There, In, She, That, Another, On, He, [PAD], According, These, One, When, Some, At, After"
blocks.1.ff_or_moe,245,0.4162,0.2724,"dates, acts, features, forms, changes, names, accounts, genera, classes, venues, rows, places, offers, akes, projects, ranges, remains, shows, uses, lies"
blocks.1.ff_or_moe,246,0.4199,0.2851,"concept, question, accompanying, sheet, objective, designs, Director, design, name, ographer, superintendent, idea, plan, switch, location, purpose, rath, Originally, objectives, minimum"
blocks.1.ff_or_moe,247,0.0796,0.3382,"form, forms, forming, formed, create, first, part, shape, created, originally, 9, co, g, the, an, command, sub, either, 6, later"
blocks.1.ff_or_moe,248,0.1910,0.3346,"Mar, Ber, Bel, Fre, Har, Tor, Sh, Gu, Ch, Cor, K, Char, W, Ro, Al, N, Hel, Kar, Be, Br"
blocks.1.ff_or_moe,249,0.1814,0.3392,"', Thomas, Smith, critics, Brown, Jackson, ,, Martin, George, Carey, fans, Hall, James, biographer, Williams, Scott, son, White, Anderson, Jones"
blocks.1.ff_or_moe,250,0.5184,0.2734,"aked, Tree, bread, dance, white, beach, Egyptian, naked, electro, bite, rounded, Carolina, gum, milk, inda, Bub, affects, skin, dinner, scenes"
blocks.1.ff_or_moe,251,0.0977,0.4055,"for, that, which, about, the, each, where, other, both, over, non, some, many, those, more, these, against, For, every, all"
blocks.1.ff_or_moe,252,0.1465,0.3726,"there, here, There, no, these, this, they, numerous, none, too, various, several, another, every, nothing, only, so, very, Spanish, she"
blocks.1.ff_or_moe,253,0.2530,0.3458,"did, does, not, never, do, could, cannot, should, didn, no, refused, can, too, failed, would, actually, may, remained, very, chose"
blocks.1.ff_or_moe,254,0.1951,0.2714,"ski, who, ager, stand, sk, man, spr, training, master, brothers, interest, ’, watch, father, accounts, ', children, response, students, might"
blocks.1.ff_or_moe,255,0.1577,0.4218,"The, ., In, [PAD], ""., ."", He, This, It, On, and, They, A, As, When, One, After, ;, )., ["
blocks.2.ff_or_moe,0,0.1428,0.3729,";, were, of, from, men, who, which, ., —, (, players, including, with, ,, for, whose, and, –, would, hip"
blocks.2.ff_or_moe,1,0.1655,0.3849,"however, they, which, including, he, also, were, she, especially, though, like, initially, who, meanwhile, this, despite, whose, along, sometimes, therefore"
blocks.2.ff_or_moe,2,0.2862,0.4275,"with, between, ., relationship, ,, ;, and, at, (, of, on, —, in, as, from, for, to, was, –, had"
blocks.2.ff_or_moe,3,0.1806,0.2730,"', son, County, Davis, et, Lake, ’, ie, ley, ville, had, ius, Smith, le, Lee, stone, Scott, himself, Park, Jackson"
blocks.2.ff_or_moe,4,0.0850,0.3461,"for, to, asked, their, these, specifically, about, his, specific, upon, prior, what, with, applied, To, ears, various, him, those, both"
blocks.2.ff_or_moe,5,0.2320,0.2777,"Smith, Martin, ’, ', Harris, fan, Clark, has, Wood, Bl, Lake, Entertainment, said, wrote, reviewer, Campbell, biographer, Kelly, described, reviews"
blocks.2.ff_or_moe,6,0.0995,0.3722,"they, that, he, same, she, year, this, although, would, these, we, day, only, both, which, it, there, came, the, neither"
blocks.2.ff_or_moe,7,0.2940,0.4215,",, ., ;, and, —, in, on, (, with, from, would, for, but, or, to, had, before, as, at, also"
blocks.2.ff_or_moe,8,0.8528,0.2122,"total, smaller, sudden, ˘, 读, 馮, 건, Ụ, ဝ, 历, Uem, 銘, 厚, Ὄ, १, 給, cestershire, 宵, 충, 彌"
blocks.2.ff_or_moe,9,0.2024,0.4199,",, ., ;, (, —, "",, and, ),, or, :, –, ""., ."", who, ), in, of, ,"", )., is"
blocks.2.ff_or_moe,10,0.1520,0.4143,"them, these, him, the, what, their, this, it, his, a, her, some, those, about, seeing, many, earlier, both, how, several"
blocks.2.ff_or_moe,11,0.1439,0.4066,"began, started, on, in, their, near, begin, joined, his, continued, at, stopped, resumed, ceased, within, commenced, working, opened, active, begun"
blocks.2.ff_or_moe,12,0.1365,0.2990,"co, -, re, inter, pre, pro, sub, trans, im, fl, cast, human, ex, cl, current, non, Pre, counter, cor, initial"
blocks.2.ff_or_moe,13,0.4062,0.3099,"varying, 2003, third, Very, 5th, weak, Small, seemingly, different, pure, very, 2004, 1984, sudden, middle, pretty, novel, 1904, beautiful, Merry"
blocks.2.ff_or_moe,14,0.1405,0.4282,"they, he, He, This, however, she, It, She, while, there, often, Then, They, 000, usually, An, But, it, these, The"
blocks.2.ff_or_moe,15,0.2772,0.2875,"other, start, large, Ry, end, expense, small, nearby, lesser, subsequent, larger, crucial, conclusion, unusual, Horn, third, contrary, obvious, remote, beginning"
blocks.2.ff_or_moe,16,0.1755,0.2912,"additional, money, help, go, significant, fuel, physical, serious, separate, further, pro, legal, medical, do, dis, use, increased, leave, short, water"
blocks.2.ff_or_moe,17,0.2307,0.4052,"and, (, ,, or, —, with, ., ;, –, of, which, but, as, is, before, were, that, between, would, :"
blocks.2.ff_or_moe,18,0.1327,0.3262,"not, also, taken, poor, never, originally, said, already, held, the, still, been, made, initially, announced, re, considered, found, based, seen"
blocks.2.ff_or_moe,19,0.2853,0.4632,"with, ., ,, ;, and, during, but, for, while, —, after, as, :, until, in, when, to, from, by, before"
blocks.2.ff_or_moe,20,0.1210,0.3769,"The, "", A, In, ("", S, When, This, T, It, I, While, There, D, Although, O, he, “, sm, As"
blocks.2.ff_or_moe,21,0.1780,0.4012,"but, while, which, with, including, although, and, as, though, along, when, after, who, so, in, called, despite, before, where, then"
blocks.2.ff_or_moe,22,0.1637,0.3016,"war, against, campaign, was, would, battle, broke, ring, caused, will, had, era, between, ended, forces, became, effort, project, fight, map"
blocks.2.ff_or_moe,23,0.3553,0.3512,"As, this, Once, When, these, Because, While, If, Before, neither, Although, After, Like, addition, Originally, Since, example, Despite, According, Now"
blocks.2.ff_or_moe,24,0.2433,0.3559,"middle, second, next, third, final, entire, resulting, group, lower, remaining, rear, remainder, fourth, wider, game, whole, full, space, fifth, upper"
blocks.2.ff_or_moe,25,0.1912,0.3912,"although, while, but, though, which, because, so, when, there, before, with, despite, where, they, he, until, however, if, either, according"
blocks.2.ff_or_moe,26,0.1276,0.3844,"by, a, both, such, in, it, each, them, several, during, many, their, some, on, an, at, only, two, before, earlier"
blocks.2.ff_or_moe,27,0.1164,0.3021,",, million, ., 000, –, times, km, %, 80, BC, thousand, v, people, years, 7, :, 00, 30, ;, known"
blocks.2.ff_or_moe,28,0.3395,0.3914,"The, According, These, On, During, [PAD], This, At, They, After, Both, There, It, With, Although, Its, In, Within, From, Their"
blocks.2.ff_or_moe,29,0.6694,0.3015,"Additional, implied, novel, ires, progressive, modified, proposed, saved, revised, resulting, 吾, ى, heightened, 展, 給, 宅, ˘, 读, 銘, otilla"
blocks.2.ff_or_moe,30,0.0677,0.3739,"other, later, others, E, W, then, said, about, eventually, that, and, those, I, finally, sometimes, their, /, also, even, David"
blocks.2.ff_or_moe,31,0.2424,0.3250,"US, PA, AD, DE, NY, H, SA, BC, SR, MS, RS, X, FA, U, MA, UK, Q, MD, K, B"
blocks.2.ff_or_moe,32,0.1382,0.4137,"the, their, these, this, his, its, what, most, those, each, all, To, them, both, her, lines, some, such, other, existing"
blocks.2.ff_or_moe,33,0.2714,0.2837,"idea, previous, same, Art, circumstances, 2003, various, Mal, whole, 2004, Ohio, difficult, Other, Three, University, politics, story, events, Mountain, source"
blocks.2.ff_or_moe,34,0.2809,0.3586,"resulting, She, His, They, With, Their, Although, Both, He, This, Its, Five, Additionally, An, First, In, desired, Also, Three, whose"
blocks.2.ff_or_moe,35,0.3473,0.3960,"[PAD], This, There, They, After, Although, It, While, These, Both, During, According, )., With, );, The, Its, Their, ""[, On"
blocks.2.ff_or_moe,36,0.1934,0.4148,"but, while, although, which, who, and, though, when, including, where, because, with, rather, whose, so, despite, even, ;, however, whereas"
blocks.2.ff_or_moe,37,0.2007,0.4158,"of, by, (, ., ;, —, ,, –, or, in, /, and, for, II, until, listed, ""., at, but, with"
blocks.2.ff_or_moe,38,0.1720,0.3372,"con, mis, cur, po, se, en, mal, cor, ex, st, em, ens, mor, ad, ver, cr, cri, sub, pre, ven"
blocks.2.ff_or_moe,39,0.2426,0.3150,"had, went, became, could, also, eventually, received, did, returned, would, never, cannot, continued, remained, She, moved, himself, refused, appeared, initially"
blocks.2.ff_or_moe,40,0.1568,0.3191,"their, those, become, having, never, the, been, its, provide, featuring, merely, producing, either, have, remain, perhaps, most, his, possibly, give"
blocks.2.ff_or_moe,41,0.4355,0.3636,"One, Many, Another, Much, Shortly, Some, shorter, alternate, More, newer, Soon, explanation, However, Meanwhile, Eight, easier, [PAD], bigger, Later, Because"
blocks.2.ff_or_moe,42,0.0518,0.3371,",, The, —, book, ship, group, ;, (, John, company, ., Prince, wife, named, ', Simon, King, family, called, Mary"
blocks.2.ff_or_moe,43,0.1109,0.4141,"this, these, the, their, various, his, The, several, both, which, On, a, 9, most, another, W, other, either, 4, its"
blocks.2.ff_or_moe,44,0.1440,0.2966,"time, power, period, lines, ing, performance, training, public, past, school, standard, or, operations, law, state, fuel, practice, travel, service, control"
blocks.2.ff_or_moe,45,0.0939,0.3331,"the, their, his, front, a, order, some, which, both, every, several, its, this, New, terms, an, St, any, July, March"
blocks.2.ff_or_moe,46,0.3924,0.2862,"remainder, entire, respective, latter, players, remaining, initial, game, decisions, Players, album, inexperienced, sudden, Finally, brave, differing, inner, underlying, assembled, player"
blocks.2.ff_or_moe,47,0.2233,0.3560,"south, along, west, north, route, area, between, town, site, east, bridge, built, Road, itself, line, was, crossing, northeast, Bridge, northwest"
blocks.2.ff_or_moe,48,0.1317,0.3618,"to, in, as, only, at, a, not, by, on, there, being, so, an, for, included, very, found, having, no, featured"
blocks.2.ff_or_moe,49,0.1425,0.3601,",, ., —, (, ;, was, and, ', II, on, -, is, became, had, or, ware, III, did, Records, :"
blocks.2.ff_or_moe,50,0.2167,0.3839,"City, United, region, Central, County, —, East, University, Beach, Europe, ;, Army, territory, Department, Island, Japan, Province, where, National, Lake"
blocks.2.ff_or_moe,51,0.1508,0.3712,"O, Martin, Mc, T, Paul, ', Al, Ben, George, D, Peter, Rose, C, Michael, Tom, Lee, James, Nick, Brown, De"
blocks.2.ff_or_moe,52,0.2343,0.3780,"different, many, small, significant, various, several, additional, times, other, notable, numerous, few, others, smaller, people, individual, multiple, prominent, independent, large"
blocks.2.ff_or_moe,53,0.2937,0.3003,"original, own, initial, story, actual, personal, entire, unique, final, efforts, creative, visit, legal, chosen, actions, traditional, 2005, stay, existing, attempts"
blocks.2.ff_or_moe,54,0.1622,0.3423,"this, the, At, their, February, these, After, before, his, subsequent, January, June, its, Before, those, September, October, November, World, entering"
blocks.2.ff_or_moe,55,0.0684,0.3317,"been, have, had, become, already, not, come, long, a, no, received, Having, run, two, an, several, their, built, set, to"
blocks.2.ff_or_moe,56,0.4140,0.2676,"ism, Society, ised, ities, properties, ized, horse, ization, oid, Key, Service, Light, ite, Super, Boy, Labor, Native, Holiday, motor, ise"
blocks.2.ff_or_moe,57,0.1940,0.3761,"of, (, ,, ., for, —, ', ;, and, is, or, on, which, has, itself, may, back, also, by, ’"
blocks.2.ff_or_moe,58,0.2806,0.2738,"species, fish, (, trees, blue, may, bird, brown, population, populations, remains, skin, shell, shells, colonies, collected, leaves, or, subspecies, yellow"
blocks.2.ff_or_moe,59,0.3004,0.3350,"She, This, [PAD], The, nob, usually, Film, Those, There, typically, On, often, approximately, assembled, These, Other, Thus, Then, According, therefore"
blocks.2.ff_or_moe,60,0.0920,0.3033,"ay, J, L, W, go, Qu, O, is, 2, are, ai, ., P, ach, N, Smith, ak, id, ev, ine"
blocks.2.ff_or_moe,61,0.0701,0.3337,"role, of, in, story, on, ability, appearance, at, for, within, among, experience, change, when, relationship, position, ;, that, roles, ."
blocks.2.ff_or_moe,62,0.2793,0.3252,"Division, World, League, Team, Day, First, Group, National, Championship, One, International, Special, Master, Second, Cup, Women, Under, Re, Best, Class"
blocks.2.ff_or_moe,63,0.3200,0.4497,"three, four, six, eight, two, five, nine, seven, years, ten, weeks, months, days, hours, eleven, consecutive, additional, twelve, minutes, separate"
blocks.2.ff_or_moe,64,0.1925,0.2658,"', had, ’, himself, Smith, began, Hill, ian, returned, &, Brown, Thomas, Williams, could, Johnson, mere, Park, 3D, Avenue, Anderson"
blocks.2.ff_or_moe,65,0.3301,0.4334,"of, on, ,, from, in, (, at, ., with, for, to, was, between, and, ;, —, had, that, by, when"
blocks.2.ff_or_moe,66,0.3367,0.3019,"related, assisted, Sh, Day, specific, Ge, based, Other, induced, supported, therefore, powered, built, ray, aided, Base, shaped, damaged, equipped, inspired"
blocks.2.ff_or_moe,67,0.1440,0.3482,"various, those, either, their, the, June, subsequent, each, another, some, whom, its, these, others, both, smaller, different, To, whose, November"
blocks.2.ff_or_moe,68,0.1674,0.2884,"Mary, ie, wood, ith, is, Hill, es, Lake, ', God, Lord, church, ern, ai, ar, ain, al, Church, Sk, ik"
blocks.2.ff_or_moe,69,0.1182,0.4119,"it, The, both, their, this, though, while, although, they, [PAD], but, such, as, his, either, that, its, );, each, these"
blocks.2.ff_or_moe,70,0.1048,0.3735,"the, their, his, least, various, different, what, first, all, some, these, both, great, this, its, which, short, number, very, those"
blocks.2.ff_or_moe,71,0.1381,0.3490,";, ,, ., with, :, —, ("", (, ke, who, in, for, before, king, made, se, used, of, and, led"
blocks.2.ff_or_moe,72,0.2873,0.3075,"original, entire, balance, idea, existing, story, additional, remaining, necessary, energy, ideas, challenge, new, whole, remainder, claims, huge, title, “, decisions"
blocks.2.ff_or_moe,73,0.3834,0.4883,"October, June, November, September, July, December, May, August, morning, April, January, February, next, 9, evening, March, which, afternoon, days, 20"
blocks.2.ff_or_moe,74,0.1860,0.3574,"those, nearly, 20, least, than, 30, 40, almost, just, what, 300, ordinary, 100, 200, significant, 50, 25, similar, unknown, other"
blocks.2.ff_or_moe,75,0.2522,0.3474,"third, true, fourth, second, fifth, sixth, official, private, quick, original, seventh, source, preferred, standard, single, best, dominant, real, full, personal"
blocks.2.ff_or_moe,76,0.1773,0.3433,"large, small, new, full, separate, single, different, special, larger, powerful, third, Spanish, greater, letter, very, smaller, waiting, red, 20, metal"
blocks.2.ff_or_moe,77,0.1403,0.2932,"considered, used, said, found, called, made, a, able, mo, m, seen, th, difficult, located, produced, be, somewhat, McCall, easily, known"
blocks.2.ff_or_moe,78,0.2658,0.3601,"character, game, computer, characters, design, gameplay, play, player, board, cast, screen, story, plot, graphics, games, system, development, animation, power, technology"
blocks.2.ff_or_moe,79,0.2762,0.2781,"if, ie, era, ler, mere, aim, any, i, ib, Evans, ington, Match, om, ish, deal, act, ime, ney, ers, someone"
blocks.2.ff_or_moe,80,0.2926,0.3113,"powerful, good, likely, dominant, successful, highly, popular, clear, sole, beautiful, separate, general, prominent, true, distinct, very, third, “, bright, flag"
blocks.2.ff_or_moe,81,0.3916,0.0000,"1, 17, 19, 18, 15, 24, 2, 35, 16, 22, 13, 28, 8, 23, 12, 26, 25, %, 4, 27"
blocks.2.ff_or_moe,82,0.2175,0.4094,"The, A, When, [PAD], 4, It, 12, This, 14, 13, 6, 15, 40, 10, 3, 2, 30, 34, In, 5"
blocks.2.ff_or_moe,83,0.3823,0.4056,"west, eastern, southern, northern, 3rd, summer, 6th, 19th, east, north, 8th, 7th, western, south, mid, southeast, 16th, East, late, 2nd"
blocks.2.ff_or_moe,84,0.0727,0.2703,"now, 1, The, sometimes, see, I, (, St, C, U, L, M, 2, B, New, mostly, e, often, Grant, Sun"
blocks.2.ff_or_moe,85,0.1538,0.3991,"the, a, under, several, an, no, some, its, other, another, his, various, one, more, their, her, two, high, different, this"
blocks.2.ff_or_moe,86,0.1318,0.4063,"their, a, an, another, his, these, the, many, this, one, previous, any, either, both, what, having, each, As, most, other"
blocks.2.ff_or_moe,87,0.2664,0.2965,"an, increase, additional, 180, army, improved, important, separate, eta, An, Allan, significant, benefit, increased, Edgar, modern, original, attempt, advance, distinct"
blocks.2.ff_or_moe,88,0.1913,0.4202,"., ;, from, :, during, with, without, for, in, ,, until, through, throughout, on, across, at, —, into, such, about"
blocks.2.ff_or_moe,89,0.2241,0.4132,"in, ., ;, on, during, ,, at, when, after, with, —, before, by, due, from, to, prior, within, without, again"
blocks.2.ff_or_moe,90,0.2042,0.3503,"that, how, said, showed, what, states, noted, something, say, indicated, it, about, says, concluded, regarding, reports, claims, suggests, suggested, he"
blocks.2.ff_or_moe,91,0.3145,0.4112,"This, It, The, With, They, After, These, She, On, Each, [...], When, ”, There, From, these, Their, His, Of, Act"
blocks.2.ff_or_moe,92,0.3236,0.3145,"largest, fact, addition, rest, greater, introduction, smaller, highest, presence, result, possibility, increase, original, larger, higher, usual, lack, lowest, reason, likes"
blocks.2.ff_or_moe,93,0.3246,0.3066,"widely, considered, commonly, intended, generally, featured, shown, formally, chosen, stead, named, taken, 61, described, supported, declared, listed, appearing, scheduled, used"
blocks.2.ff_or_moe,94,0.3439,0.4042,"George, Charles, Robert, Henry, Richard, John, David, William, James, Joseph, Paul, Michael, Edward, Thomas, Frank, President, Peter, Walter, General, Mark"
blocks.2.ff_or_moe,95,0.1579,0.4385,"the, it, most, that, both, but, they, "", all, he, there, which, their, a, such, many, this, its, so, his"
blocks.2.ff_or_moe,96,0.1014,0.3710,",, ;, ., School, house, —, school, where, area, complex, hall, near, town, building, grounds, church, level, facility, campus, with"
blocks.2.ff_or_moe,97,0.1564,0.3737,"..., ], ."", [, ""., "",, ,"", ., would, are, will, on, now, is, has, —, from, before, ;, may"
blocks.2.ff_or_moe,98,0.1397,0.3169,"do, does, this, done, so, not, did, very, make, doing, what, some, these, similar, om, little, work, novel, Devil, Emerson"
blocks.2.ff_or_moe,99,0.0638,0.3246,"who, ;, of, community, group, among, state, nature, —, period, ,, people, character, ., party, version, and, (, model, leader"
blocks.2.ff_or_moe,100,0.1105,0.3179,",, ;, —, century, ., :, that, 0s, (, and, "",, AD, ', –, /, BC, with, brought, when, after"
blocks.2.ff_or_moe,101,0.4566,0.2523,"biggest, song, advantages, title, same, inaugural, skills, chances, highest, opportunity, benefits, nutrients, results, amount, praises, hopes, sole, consequences, necessary, risks"
blocks.2.ff_or_moe,102,0.4181,0.3494,"Although, This, They, Other, Their, After, She, ologies, These, On, While, With, Thus, elles, Because, Each, newer, )""., Those, disagreement"
blocks.2.ff_or_moe,103,0.2299,0.4752,";, ., from, ,, on, :, in, during, for, by, before, at, —, with, when, ),, ."", within, after, )"
blocks.2.ff_or_moe,104,0.1431,0.3626,";, ., of, :, where, that, ,, —, before, since, when, without, such, until, to, they, including, alone, ..., as"
blocks.2.ff_or_moe,105,0.1963,0.3371,"/, wind, +, 60, 1, 3, L, 110, 50, x, 5, 0, 7, hard, 100, 40, 4, 2, winds, cl"
blocks.2.ff_or_moe,106,0.2895,0.2865,"or, possibly, sometimes, perhaps, otherwise, risk, whatever, any, Dawn, even, simply, our, occasionally, indeed, om, truth, specific, others, Roth, ris"
blocks.2.ff_or_moe,107,0.2905,0.3256,"third, fourth, second, single, report, fifth, 180, revised, novel, last, decade, final, actual, cannot, successful, 2003, fight, specific, corps, larger"
blocks.2.ff_or_moe,108,0.2334,0.3226,"own, personal, His, private, brother, entire, original, previous, initial, immediate, extensive, final, primary, third, efforts, senior, thoughts, his, old, sons"
blocks.2.ff_or_moe,109,0.1928,0.3893,"they, although, there, she, neither, Although, he, ""[, none, [PAD], these, There, The, While, Both, both, despite, according, With, however"
blocks.2.ff_or_moe,110,0.2358,0.3811,"We, we, Can, I, You, He, you, know, didn, ’, Who, wanted, chose, have, would, iz, want, cannot, wrote, did"
blocks.2.ff_or_moe,111,0.1049,0.4042,"other, some, their, thus, others, those, its, several, then, the, later, many, W, so, had, even, which, various, sometimes, therefore"
blocks.2.ff_or_moe,112,0.3164,0.3324,"been, really, quite, ever, going, wanted, seen, want, prepared, always, approved, officially, tried, recognized, looked, like, considered, completely, caught, good"
blocks.2.ff_or_moe,113,0.1270,0.3962,"the, through, its, their, this, behind, those, a, his, these, two, what, that, via, an, another, various, them, where, which"
blocks.2.ff_or_moe,114,0.1428,0.3462,"', ,, ;, —, (, ., who, ’, and, had, :, was, were, also, Smith, –, in, ford, II, then"
blocks.2.ff_or_moe,115,0.1946,0.2860,"s, 80s, say, Only, ’, They, 90s, His, Allan, Close, Gr, ath, ', material, t, position, Daniel, About, ""', John"
blocks.2.ff_or_moe,116,0.4093,0.3294,"2003, smaller, weak, 180, Ross, Bow, shorter, 2004, Small, fourth, lower, novel, larger, Sol, weaker, campaign, revised, prolonged, appeal, lesser"
blocks.2.ff_or_moe,117,0.1336,0.3175,"-, heart, water, s, st, fat, dog, ed, y, ly, child, cut, clean, relief, test, blind, sh, ing, back, skin"
blocks.2.ff_or_moe,118,0.1026,0.3763,"which, the, this, The, these, most, either, Act, whose, many, both, various, South, his, several, their, any, 2004, Great, today"
blocks.2.ff_or_moe,119,0.2508,0.3341,"be, have, helped, become, been, make, serve, take, found, provide, help, considered, come, build, qualified, not, give, qualify, chosen, came"
blocks.2.ff_or_moe,120,0.0771,0.3164,"the, be, this, their, various, help, study, a, make, search, front, work, support, provide, view, its, Africa, what, an, secure"
blocks.2.ff_or_moe,121,0.1030,0.3649,"the, outside, their, a, this, all, an, being, his, various, its, both, home, these, The, different, left, that, V, which"
blocks.2.ff_or_moe,122,0.4806,0.6441,"May, September, June, November, December, August, October, July, March, April, February, January, 27, 28, 2007, 22, 2009, 26, 29, 24"
blocks.2.ff_or_moe,123,0.2849,0.4502,"., ;, ,, —, by, at, on, and, with, where, :, from, as, to, in, ', during, for, through, due"
blocks.2.ff_or_moe,124,0.0979,0.3849,"a, an, part, they, well, the, as, having, their, being, one, far, it, soon, he, good, another, co, The, some"
blocks.2.ff_or_moe,125,0.3458,0.2756,"largely, black, dis, isolated, used, heavily, particularly, wooded, referred, neutral, excluded, designed, prominent, specifically, connected, mainly, politically, Hopkins, positively, critically"
